{
  "$schema": "https://json-schema.org/draft/2020-12/schema",
  "$id": "https://llmwiki.net/schemas/private/browser-executor/job-v1.schema.json",
  "title": "LLM Wiki bounded browser program",
  "type": "object",
  "additionalProperties": false,
  "required": [
    "protocol", "program_id", "program_sha256", "plan_sha256", "driver",
    "capability", "target", "limits", "private_slots", "actions", "result"
  ],
  "properties": {
    "protocol": {"const": "llm-wiki-browser-executor/v1"},
    "program_id": {"type": "string", "pattern": "^[A-Za-z0-9][A-Za-z0-9._-]{0,127}$"},
    "program_sha256": {"$ref": "#/$defs/sha256"},
    "plan_sha256": {"$ref": "#/$defs/sha256"},
    "driver": {
      "type": "object",
      "additionalProperties": false,
      "required": ["id", "version"],
      "properties": {
        "id": {"type": "string", "pattern": "^[a-z0-9](?:[a-z0-9-]{0,62}[a-z0-9])?$"},
        "version": {"type": "string", "pattern": "^[A-Za-z0-9][A-Za-z0-9._-]{0,127}$"}
      }
    },
    "capability": {"enum": ["read", "mutation"]},
    "target": {
      "type": "object",
      "additionalProperties": false,
      "required": ["url", "origin", "path_prefixes", "collaboration_id"],
      "properties": {
        "url": {
          "type": "string", "format": "uri",
          "pattern": "^https://"
        },
        "origin": {"type": "string", "format": "uri", "pattern": "^https://"},
        "collaboration_id": {"$ref": "#/$defs/sha256"},
        "path_prefixes": {
          "type": "array", "minItems": 1, "maxItems": 8, "uniqueItems": true,
          "items": {"type": "string", "pattern": "^/", "maxLength": 2048}
        }
      }
    },
    "limits": {
      "type": "object",
      "additionalProperties": false,
      "required": ["timeout_ms", "max_actions", "max_repeat"],
      "properties": {
        "timeout_ms": {"type": "integer", "minimum": 1000, "maximum": 300000},
        "max_actions": {"type": "integer", "minimum": 1, "maximum": 200},
        "max_repeat": {"type": "integer", "minimum": 1, "maximum": 20}
      }
    },
    "private_slots": {
      "type": "array", "maxItems": 32, "uniqueItems": true,
      "items": {"$ref": "#/$defs/privateField"}
    },
    "actions": {
      "type": "array", "minItems": 1, "maxItems": 200,
      "items": {"$ref": "#/$defs/action"}
    },
    "result": {
      "type": "object",
      "additionalProperties": false,
      "required": ["public_fields", "private_fields"],
      "properties": {
        "public_fields": {
          "type": "array", "uniqueItems": true,
          "items": {"enum": ["status", "action_count", "mutation_started", "private_result_count"]}
        },
        "private_fields": {
          "type": "array", "maxItems": 32, "uniqueItems": true,
          "items": {"$ref": "#/$defs/privateField"}
        }
      }
    }
  },
  "$defs": {
    "sha256": {"type": "string", "pattern": "^[a-f0-9]{64}$"},
    "privateField": {"type": "string", "pattern": "^[a-z0-9](?:[a-z0-9._-]{0,126}[a-z0-9])?$"},
    "locator": {
      "type": "object",
      "minProperties": 1,
      "additionalProperties": false,
      "properties": {
        "selector": {"type": "string", "minLength": 1, "maxLength": 16384},
        "role": {"type": "string", "pattern": "^[a-z0-9](?:[a-z0-9-]{0,62}[a-z0-9])?$"},
        "roles": {
          "type": "array", "minItems": 1, "maxItems": 8, "uniqueItems": true,
          "items": {"type": "string", "pattern": "^[a-z0-9](?:[a-z0-9-]{0,62}[a-z0-9])?$"}
        },
        "name": {"type": "string", "minLength": 1, "maxLength": 16384},
        "name_contains": {"type": "string", "minLength": 1, "maxLength": 16384},
        "name_contains_any": {"$ref": "#/$defs/stringList"},
        "name_matches": {"type": "string", "minLength": 1, "maxLength": 256},
        "within": {"$ref": "#/$defs/locator"},
        "within_name_contains_any": {"$ref": "#/$defs/stringList"},
        "ordinal": {"type": "integer", "minimum": 0, "maximum": 1000},
        "visible": {"type": "boolean"},
        "checked": {"type": "boolean"},
        "focused": {"type": "boolean"},
        "unique": {"type": "boolean"}
      }
    },
    "stringList": {
      "type": "array", "minItems": 1, "maxItems": 12,
      "items": {"type": "string", "minLength": 1, "maxLength": 512}
    },
    "plainAction": {
      "type": "object", "additionalProperties": false, "required": ["op"],
      "properties": {
        "op": {"enum": ["open_or_focus_exact_url", "assert_exact_target", "attach_debugger", "detach_debugger", "stop_log_capture", "stop_request_capture", "stop_console_capture", "before_mutation"]}
      }
    },
    "navigateAction": {
      "type": "object", "additionalProperties": false, "required": ["op", "url"],
      "properties": {
        "op": {"const": "navigate_same_origin"},
        "url": {"type": "string", "format": "uri", "pattern": "^https://", "maxLength": 16384}
      }
    },
    "locatedAction": {
      "type": "object", "additionalProperties": false, "required": ["op", "locator"],
      "properties": {
        "op": {"enum": ["assert_ax", "click_ax", "click_dom", "focus_ax"]},
        "locator": {"$ref": "#/$defs/locator"}
      }
    },
    "waitAction": {
      "type": "object", "additionalProperties": false, "required": ["op", "locator", "timeout_ms"],
      "properties": {
        "op": {"enum": ["wait_ax", "wait_dom"]},
        "locator": {"$ref": "#/$defs/locator"},
        "timeout_ms": {"type": "integer", "minimum": 50, "maximum": 300000}
      }
    },
    "branchAction": {
      "type": "object", "additionalProperties": false, "required": ["op", "branches"],
      "properties": {
        "op": {"const": "first_success"},
        "branches": {
          "type": "array", "minItems": 1, "maxItems": 4,
          "items": {"type": "array", "minItems": 1, "items": {"$ref": "#/$defs/action"}}
        }
      }
    },
    "keyAction": {
      "type": "object", "additionalProperties": false, "required": ["op", "keys"],
      "properties": {
        "op": {"const": "dispatch_key_chord"},
        "keys": {
          "type": "array", "minItems": 1, "maxItems": 5, "uniqueItems": true,
          "items": {
            "enum": [
              "platform-primary", "control", "meta", "alt", "shift", "enter", "escape", "tab",
              "arrow-up", "arrow-down", "arrow-left", "arrow-right", "backspace", "delete",
              "a", "b", "c", "d", "e", "f", "g", "h", "i", "j", "k", "l", "m", "n", "o",
              "p", "q", "r", "s", "t", "u", "v", "w", "x", "y", "z",
              "0", "1", "2", "3", "4", "5", "6", "7", "8", "9"
            ]
          }
        }
      }
    },
    "privateAction": {
      "type": "object", "additionalProperties": false, "required": ["op", "slot"],
      "properties": {
        "op": {"enum": ["insert_private_text", "assert_ax_private_value"]},
        "slot": {"$ref": "#/$defs/privateField"},
        "replace_all": {"type": "boolean"}
      }
    },
    "privateWaitAction": {
      "type": "object", "additionalProperties": false,
      "required": ["op", "slot", "timeout_ms"],
      "properties": {
        "op": {"const": "wait_ax_private_value"},
        "slot": {"$ref": "#/$defs/privateField"},
        "timeout_ms": {"type": "integer", "minimum": 50, "maximum": 300000}
      }
    },
    "privateHashAction": {
      "type": "object", "additionalProperties": false,
      "required": ["op", "slot", "locator", "fields", "max_items"],
      "properties": {
        "op": {"const": "assert_ax_private_sha256"},
        "slot": {"$ref": "#/$defs/privateField"},
        "locator": {"$ref": "#/$defs/locator"},
        "fields": {
          "type": "array", "minItems": 1, "maxItems": 7, "uniqueItems": true,
          "items": {"enum": ["name", "role", "value", "description", "url", "checked", "focused"]}
        },
        "max_items": {"type": "integer", "minimum": 1, "maximum": 5000}
      }
    },
    "extractAction": {
      "type": "object", "additionalProperties": false,
      "required": ["op", "locator", "fields", "private_result", "max_items"],
      "properties": {
        "op": {"enum": ["extract_ax", "extract_ax_collection"]},
        "locator": {"$ref": "#/$defs/locator"},
        "fields": {
          "type": "array", "minItems": 1, "maxItems": 7, "uniqueItems": true,
          "items": {"enum": ["name", "role", "value", "description", "url", "checked", "focused"]}
        },
        "private_result": {"$ref": "#/$defs/privateField"},
        "max_items": {"type": "integer", "minimum": 1, "maximum": 5000}
      }
    },
    "scrollCollectionAction": {
      "type": "object", "additionalProperties": false,
      "required": [
        "op", "locator", "fields", "private_result", "max_items", "direction",
        "distance_px", "max_scrolls", "settle_ms", "dedupe_fields", "stable_rounds",
        "scroll_anchor"
      ],
      "properties": {
        "op": {"const": "collect_ax_by_scrolling"},
        "locator": {"$ref": "#/$defs/locator"},
        "fields": {
          "type": "array", "minItems": 1, "maxItems": 7, "uniqueItems": true,
          "items": {"enum": ["name", "role", "value", "description", "url", "checked", "focused"]}
        },
        "private_result": {"$ref": "#/$defs/privateField"},
        "max_items": {"type": "integer", "minimum": 1, "maximum": 5000},
        "direction": {"enum": ["up", "down"]},
        "distance_px": {"type": "integer", "minimum": 1, "maximum": 10000},
        "max_scrolls": {"type": "integer", "minimum": 1, "maximum": 20},
        "settle_ms": {"type": "integer", "minimum": 50, "maximum": 3000},
        "dedupe_fields": {
          "type": "array", "minItems": 1, "maxItems": 7, "uniqueItems": true,
          "items": {"enum": ["name", "role", "value", "description", "url", "checked", "focused"]}
        },
        "stable_rounds": {"type": "integer", "minimum": 1, "maximum": 3},
        "scroll_anchor": {"$ref": "#/$defs/locator"}
      }
    },
    "screenshotAction": {
      "type": "object", "additionalProperties": false,
      "required": ["op", "private_result", "quality", "max_bytes"],
      "properties": {
        "op": {"const": "capture_viewport_private"},
        "private_result": {"$ref": "#/$defs/privateField"},
        "quality": {"type": "integer", "minimum": 10, "maximum": 90},
        "max_bytes": {"type": "integer", "minimum": 16384, "maximum": 262144}
      }
    },
    "scrollAction": {
      "type": "object", "additionalProperties": false,
      "required": ["op", "direction", "distance_px"],
      "properties": {
        "op": {"const": "scroll_viewport"},
        "direction": {"enum": ["up", "down"]},
        "distance_px": {"type": "integer", "minimum": 1, "maximum": 10000}
      }
    },
    "logCaptureAction": {
      "type": "object", "additionalProperties": false,
      "required": ["op", "private_result", "max_entries", "max_text_bytes"],
      "properties": {
        "op": {"const": "start_log_capture"},
        "private_result": {"$ref": "#/$defs/privateField"},
        "max_entries": {"type": "integer", "minimum": 1, "maximum": 500},
        "max_text_bytes": {"type": "integer", "minimum": 256, "maximum": 16384}
      }
    },
    "requestCaptureAction": {
      "type": "object", "additionalProperties": false,
      "required": ["op", "private_result", "max_entries", "max_url_bytes"],
      "properties": {
        "op": {"const": "start_request_capture"},
        "private_result": {"$ref": "#/$defs/privateField"},
        "max_entries": {"type": "integer", "minimum": 1, "maximum": 500},
        "max_url_bytes": {"type": "integer", "minimum": 256, "maximum": 16384}
      }
    },
    "consoleCaptureAction": {
      "type": "object", "additionalProperties": false,
      "required": ["op", "private_result", "max_entries", "max_arguments", "max_argument_bytes"],
      "properties": {
        "op": {"const": "start_console_capture"},
        "private_result": {"$ref": "#/$defs/privateField"},
        "max_entries": {"type": "integer", "minimum": 1, "maximum": 500},
        "max_arguments": {"type": "integer", "minimum": 1, "maximum": 20},
        "max_argument_bytes": {"type": "integer", "minimum": 256, "maximum": 16384}
      }
    },
    "extendedAction": {
      "oneOf": [
        {
          "type": "object", "additionalProperties": false,
          "required": ["op", "url"],
          "properties": {
            "op": {"enum": ["create_same_origin_tab"]},
            "url": {"type": "string", "format": "uri", "pattern": "^https://", "maxLength": 16384}
          }
        },
        {
          "type": "object", "additionalProperties": false,
          "required": ["op", "direction", "expected_url"],
          "properties": {
            "op": {"const": "navigate_history"},
            "direction": {"enum": ["back", "forward"]},
            "expected_url": {"type": "string", "format": "uri", "pattern": "^https://", "maxLength": 16384}
          }
        },
        {
          "type": "object", "additionalProperties": false, "required": ["op"],
          "properties": {"op": {"const": "close_target_tab"}}
        },
        {
          "type": "object", "additionalProperties": false,
          "required": ["op", "ignore_cache"],
          "properties": {"op": {"const": "reload_exact_target"}, "ignore_cache": {"type": "boolean"}}
        },
        {
          "type": "object", "additionalProperties": false,
          "required": ["op", "locator"],
          "properties": {
            "op": {"enum": ["hover_ax", "scroll_ax_into_view"]},
            "locator": {"$ref": "#/$defs/locator"}
          }
        },
        {
          "type": "object", "additionalProperties": false,
          "required": ["op", "locator", "destination", "steps"],
          "properties": {
            "op": {"const": "drag_ax"}, "locator": {"$ref": "#/$defs/locator"},
            "destination": {"$ref": "#/$defs/locator"},
            "steps": {"type": "integer", "minimum": 2, "maximum": 50}
          }
        },
        {
          "type": "object", "additionalProperties": false,
          "required": ["op", "locator", "option_locator"],
          "properties": {
            "op": {"const": "select_ax_option"}, "locator": {"$ref": "#/$defs/locator"},
            "option_locator": {"$ref": "#/$defs/locator"}
          }
        },
        {
          "type": "object", "additionalProperties": false,
          "required": ["op", "private_result", "quality", "max_bytes", "x", "y", "width", "height"],
          "properties": {
            "op": {"const": "capture_region_private"}, "private_result": {"$ref": "#/$defs/privateField"},
            "quality": {"type": "integer", "minimum": 10, "maximum": 90},
            "max_bytes": {"type": "integer", "minimum": 16384, "maximum": 262144},
            "x": {"type": "number", "minimum": 0, "maximum": 100000},
            "y": {"type": "number", "minimum": 0, "maximum": 100000},
            "width": {"type": "number", "minimum": 1, "maximum": 10000},
            "height": {"type": "number", "minimum": 1, "maximum": 10000}
          }
        },
        {
          "type": "object", "additionalProperties": false,
          "required": ["op", "private_result", "quality", "max_bytes", "max_width", "max_height"],
          "properties": {
            "op": {"const": "capture_full_page_private"}, "private_result": {"$ref": "#/$defs/privateField"},
            "quality": {"type": "integer", "minimum": 10, "maximum": 90},
            "max_bytes": {"type": "integer", "minimum": 16384, "maximum": 262144},
            "max_width": {"type": "integer", "minimum": 1, "maximum": 20000},
            "max_height": {"type": "integer", "minimum": 1, "maximum": 20000}
          }
        },
        {
          "type": "object", "additionalProperties": false,
          "required": ["op", "locator", "private_result", "max_items"],
          "properties": {
            "op": {"const": "extract_ax_geometry"}, "locator": {"$ref": "#/$defs/locator"},
            "private_result": {"$ref": "#/$defs/privateField"},
            "max_items": {"type": "integer", "minimum": 1, "maximum": 500}
          }
        },
        {
          "type": "object", "additionalProperties": false,
          "required": ["op", "private_result", "max_metrics"],
          "properties": {
            "op": {"const": "capture_performance_private"},
            "private_result": {"$ref": "#/$defs/privateField"},
            "max_metrics": {"type": "integer", "minimum": 1, "maximum": 100}
          }
        },
        {
          "type": "object", "additionalProperties": false,
          "required": ["op", "duration_ms"],
          "properties": {"op": {"const": "wait_duration"}, "duration_ms": {"type": "integer", "minimum": 20, "maximum": 30000}}
        },
        {
          "type": "object", "additionalProperties": false,
          "required": ["op", "locator", "slot", "max_files"],
          "properties": {
            "op": {"const": "set_private_files"}, "locator": {"$ref": "#/$defs/locator"},
            "slot": {"$ref": "#/$defs/privateField"},
            "max_files": {"type": "integer", "minimum": 1, "maximum": 16}
          }
        },
        {
          "type": "object", "additionalProperties": false,
          "required": ["op", "private_result", "max_items"],
          "properties": {
            "op": {"const": "start_download_capture"}, "private_result": {"$ref": "#/$defs/privateField"},
            "max_items": {"type": "integer", "minimum": 1, "maximum": 16}
          }
        },
        {
          "type": "object", "additionalProperties": false,
          "required": ["op", "timeout_ms"],
          "properties": {"op": {"const": "stop_download_capture"}, "timeout_ms": {"type": "integer", "minimum": 100, "maximum": 120000}}
        },
        {
          "type": "object", "additionalProperties": false,
          "required": ["op", "accept"],
          "properties": {
            "op": {"const": "handle_dialog"}, "accept": {"type": "boolean"},
            "prompt_slot": {"oneOf": [{"$ref": "#/$defs/privateField"}, {"type": "null"}]}
          }
        },
        {
          "type": "object", "additionalProperties": false,
          "required": ["op", "broker"],
          "properties": {
            "op": {"const": "trigger_credential_broker"},
            "broker": {"enum": ["onepassword", "browser-password-manager"]}
          }
        }
      ]
    },
    "action": {
      "oneOf": [
        {"$ref": "#/$defs/plainAction"}, {"$ref": "#/$defs/navigateAction"},
        {"$ref": "#/$defs/locatedAction"},
        {"$ref": "#/$defs/waitAction"}, {"$ref": "#/$defs/branchAction"},
        {"$ref": "#/$defs/keyAction"}, {"$ref": "#/$defs/privateAction"},
        {"$ref": "#/$defs/privateWaitAction"},
        {"$ref": "#/$defs/privateHashAction"},
        {"$ref": "#/$defs/extractAction"}, {"$ref": "#/$defs/scrollCollectionAction"},
        {"$ref": "#/$defs/screenshotAction"},
        {"$ref": "#/$defs/scrollAction"}, {"$ref": "#/$defs/logCaptureAction"},
        {"$ref": "#/$defs/requestCaptureAction"}, {"$ref": "#/$defs/consoleCaptureAction"},
        {"$ref": "#/$defs/extendedAction"}
      ]
    }
  }
}
